{
  "publish_id": "PUB-HIST-0011",
  "task_id": "TASK-NB-20260918-006",
  "account_id": "ACCOUNT-XHS-001",
  "decision_id": "DEC-20260918-0001",
  "content_id": null,
  "publish_time": "2026-08-06T23:00:00Z",
  "status": "published",
  "actual_production_hours": 3.0,
  "revision_count": 2,
  "actual_revenue": null,
  "revenue_notes": "结算规则为 CPM/置换，按平台导出折算（synthetic）",
  "created_at": "2026-09-18T09:40:45.006663Z"
}
