{
  "publish_id": "PUB-20260918-0001",
  "task_id": "TASK-NB-20260918-002",
  "account_id": "ACCOUNT-XHS-001",
  "decision_id": "DEC-20260918-0001",
  "content_id": "DRF-20260918-0002",
  "publish_time": "2026-09-12T10:00:00Z",
  "status": "published",
  "actual_production_hours": 5.0,
  "revision_count": 1,
  "actual_revenue": 800,
  "revenue_notes": "固定费 800 已结，佣金 5%（按链接成交）未产生",
  "created_at": "2026-09-18T07:00:00Z"
}