{
  "publish_id": "PUB-HIST-0010",
  "task_id": "TASK-NB-20260918-005",
  "account_id": "ACCOUNT-DY-001",
  "decision_id": "DEC-20260918-0001",
  "content_id": null,
  "publish_time": "2026-08-06T10:00:00Z",
  "status": "published",
  "actual_production_hours": 4.4,
  "revision_count": 4,
  "actual_revenue": 1080.0,
  "revenue_notes": "固定费已结，佣金未达成",
  "created_at": "2026-09-18T08:38:43.244425Z"
}
